{
  "schemaVersion": "4.0",
  "taskId": "TASK-001",
  "goal": "Replace with a bounded low-risk outcome",
  "objectiveRefs": ["KO-001"],
  "allowedPaths": ["replace/with/path"],
  "forbiddenPaths": [".vibe-control/**"],
  "requiredCaseIds": ["CASE-001"],
  "risk": "R1",
  "maxClaimLevel": "VERIFIED",
  "authorityRefs": ["REQUIREMENTS.md"],
  "nonGoals": [],
  "humanDecisionPoints": [],
  "acceptanceCheckpoints": [{
    "id": "CP-001", "sourceRefs": ["SIG-000000000000"], "objectiveRefs": ["KO-001"],
    "statement": "Replace with one externally observable passing fact", "type": "AUTOMATED", "requiredForClaim": "VERIFIED",
    "caseIds": ["CASE-001"], "assertions": [{"id": "ASRT-001", "statement": "Replace with one observable assertion", "caseIds": ["CASE-001"]}],
    "expected": {"status": "PASS", "minExecuted": 1, "maxFailed": 0, "maxSkipped": 0, "artifacts": "AS_DECLARED"}, "notProven": []
  }],
  "checkpointConfirmation": {"actorId": "product-owner", "summary": "replace-with-confirmed-task-summary", "checkpointSetSha256": "0000000000000000000000000000000000000000000000000000000000000000", "executionPlanSha256": "0000000000000000000000000000000000000000000000000000000000000000", "record": "CHECKPOINT_CONFIRMATION.json", "confirmedAt": "2026-01-01T00:00:00Z"},
  "auditPolicy": {"strategy": "PROJECT_DERIVED", "maxExploratoryFindings": 3, "stopCondition": "ALL_REQUIRED_CHECKPOINTS_REPORTED", "requiredReviewRoles": ["INDEPENDENT_AUDITOR"], "triggerReasons": ["MILESTONE_CANDIDATE_READY"]},
  "milestones": [{
    "id": "MS-001", "outcome": "Close the first observable outcome", "objectiveRefs": ["KO-001"], "dependsOn": [],
    "workNodes": [{"id": "WN-001", "title": "Implement and check the bounded outcome", "kind": "IMPLEMENTATION", "allowedPaths": ["replace/with/path"], "minimumChecks": ["QC-001", "CASE-001"], "ownerRole": "IMPLEMENTER"}],
    "checkpointIds": ["CP-001"], "expectedPassConditions": ["CP-001 reports PASS with zero skipped cases"]
  }],
  "scorecardPlan": {"weights": {"FUNCTIONALITY": 40, "ROBUSTNESS_SECURITY": 25, "AUDIT": 20, "PROCESS": 15}, "items": [
    {"id": "SC-001", "category": "FUNCTIONALITY", "statement": "Observable outcome works", "checkpointIds": ["CP-001"], "factSources": [{"kind": "CHECKPOINT", "refs": ["CP-001"]}]},
    {"id": "SC-002", "category": "ROBUSTNESS_SECURITY", "statement": "Failure remains conserved", "checkpointIds": ["CP-001"], "factSources": [{"kind": "CASE", "refs": ["CASE-001"]}]},
    {"id": "SC-003", "category": "AUDIT", "statement": "Evidence binds the candidate", "checkpointIds": ["CP-001"], "factSources": [{"kind": "REVIEW", "refs": ["FRESH-INDEPENDENT-REVIEW"]}]},
    {"id": "SC-004", "category": "PROCESS", "statement": "Milestone stays in scope", "checkpointIds": ["CP-001"], "factSources": [{"kind": "CORE_CONTROL", "refs": ["RULE-CORE-OBSERVABLE-CANDIDATE"]}]}
  ]},
  "verificationStrategy": {
    "mode": "CANDIDATE_BOUND", "failureDisposition": "REPAIR_WITHIN_CONTRACT", "eligibleObservations": ["runtime-observed"], "requireZeroSkipped": true,
    "checkpointCases": [{"checkpointId": "CP-001", "caseIds": ["CASE-001"]}],
    "implementer": {"quickChecks": [{"id": "QC-001", "command": ["replace-with-quick-check"], "requiredBeforeMilestone": true}]},
    "executor": {"caseIds": ["CASE-001"], "evidenceRequirements": ["candidate-bound transcript", "nonzero counters", "zero skipped cases"]},
    "auditor": {"required": true, "form": "FRESH_INDEPENDENT_REVIEW", "inputs": ["candidate", "case evidence", "checkpoint expectations"], "stopCondition": "ALL_REQUIRED_CHECKPOINTS_REPORTED"},
    "notProven": ["External release readiness"]
  },
  "guardPolicy": {"defaultEffect": "ADVISORY", "guards": [
    {"id": "GUARD-ACTION", "scope": "MUTATION", "effect": "ACTION_GUARD"}, {"id": "GUARD-CLAIM", "scope": "CLAIM", "effect": "CLAIM_GUARD"}, {"id": "GUARD-PROCESS", "scope": "PROCESS", "effect": "ADVISORY"}, {"id": "GUARD-HUMAN", "scope": "HUMAN", "effect": "HUMAN_DECISION"}, {"id": "GUARD-ENVIRONMENT", "scope": "ENVIRONMENT", "effect": "ENVIRONMENT_BLOCKED"}
  ]},
  "reportingPolicy": {
    "orientation": "ZERO_CONTEXT_ORIENTATION", "progressMode": "NON_BLOCKING", "reviewPoint": "OWNER_REVIEW",
    "plainLanguageFields": ["projectPurpose", "whatWasDone", "whatWorksNow", "whatStillDoesNotWork", "userImpact", "canContinue", "canRelease"],
    "nextActions": {"continue": ["Continue the next locked work node"], "repair": ["Repair the failed check within the task boundary"], "humanReview": ["Review the candidate at the locked owner checkpoint"]}
  }
}
